A1: FileName | B1: EDUCIBone(s) | C1: Minibones(s) | D1: backbone | E1: propagate | F1: pro/bl | G1: cov | H1: cov/bl | I1: whit | J1: whit/bl | K1: 2len | L1: 2len/bl
A2: 12pipe_bug4_q0.used-as.sat04-723.cnf.out | B2: 1921 | D2: 12686 | E2: 7726 | F2: =E2/D2 -> 0.60901781491407847 | G2: 0 | H2: 0 | I2: 702 | J2: =I2/D2 -> 5.533659151820905e-002 | K2: 349 | L2: =K2/D2 -> 2.7510641652215041e-002
A3: 12pipe_bug6_q0.used-as.sat04-725.cnf.out | B3: 1670 | D3: 17082 | E3: 9060 | F3: =E3/D3 -> 0.5303828591499824 | G3: 0 | H3: 0 | I3: 608 | J3: =I3/D3 -> 3.5593021894391758e-002 | K3: 425 | L3: =K3/D3 -> 2.487999063341529e-002
A4: 289-sat-11x10.cnf.out | B4: 0 | C4: 5 | D4: 0 | E4: 0 | F4: 0 | G4: 0 | H4: 0 | I4: 0 | J4: 0 | K4: 0 | L4: 0
A5: 289-sat-11x4.cnf.out | B5: 0 | C5: 0 | D5: 0 | E5: 0 | F5: 0 | G5: 0 | H5: 0 | I5: 0 | J5: 0 | K5: 0 | L5: 0
A6: 289-sat-11x9.cnf.out | B6: 0 | C6: 0 | D6: 0 | E6: 0 | F6: 0 | G6: 0 | H6: 0 | I6: 0 | J6: 0 | K6: 0 | L6: 0
A7: 289-sat-12x14.cnf.out | B7: 0 | C7: 0 | D7: 0 | E7: 0 | F7: 0 | G7: 0 | H7: 0 | I7: 0 | J7: 0 | K7: 0 | L7: 0
A8: 289-sat-12x15.cnf.out | B8: 0 | C8: 0 | D8: 0 | E8: 0 | F8: 0 | G8: 0 | H8: 0 | I8: 0 | J8: 0 | K8: 0 | L8: 0
A9: 289-sat-14x8.cnf.out | B9: 0 | C9: 0 | D9: 0 | E9: 0 | F9: 0 | G9: 0 | H9: 0 | I9: 0 | J9: 0 | K9: 0 | L9: 0
A10: 289-sat-4x35.cnf.out | B10: 0 | C10: 0 | D10: 0 | E10: 0 | F10: 0 | G10: 0 | H10: 0 | I10: 0 | J10: 0 | K10: 0 | L10: 0
A11: 289-sat-4x8.cnf.out | B11: 0 | C11: 0 | D11: 0 | E11: 0 | F11: 0 | G11: 0 | H11: 0 | I11: 0 | J11: 0 | K11: 0 | L11: 0
A12: 289-sat-5x8.cnf.out | B12: 0 | C12: 0 | D12: 0 | E12: 0 | F12: 0 | G12: 0 | H12: 0 | I12: 0 | J12: 0 | K12: 0 | L12: 0
A13: 289-sat-6x19.cnf.out | B13: 0 | C13: 0 | D13: 0 | E13: 0 | F13: 0 | G13: 0 | H13: 0 | I13: 0 | J13: 0 | K13: 0 | L13: 0
A14: 289-sat-6x20.cnf.out | B14: 0 | C14: 0 | D14: 0 | E14: 0 | F14: 0 | G14: 0 | H14: 0 | I14: 0 | J14: 0 | K14: 0 | L14: 0
A15: 289-sat-6x8.cnf.out | B15: 0 | C15: 0 | D15: 0 | E15: 0 | F15: 0 | G15: 0 | H15: 0 | I15: 0 | J15: 0 | K15: 0 | L15: 0
A16: 289-sat-6x9.cnf.out | B16: 0 | C16: 0 | D16: 0 | E16: 0 | F16: 0 | G16: 0 | H16: 0 | I16: 0 | J16: 0 | K16: 0 | L16: 0
A17: 289-sat-7x6.cnf.out | B17: 0 | C17: 0 | D17: 0 | E17: 0 | F17: 0 | G17: 0 | H17: 0 | I17: 0 | J17: 0 | K17: 0 | L17: 0
A18: 289-sat-9x13.cnf.out | B18: 0 | C18: 0 | D18: 0 | E18: 0 | F18: 0 | G18: 0 | H18: 0 | I18: 0 | J18: 0 | K18: 0 | L18: 0
A19: 289-unsat-6x30.cnf.out | B19: 63 | D19: 0 | E19: 0 | F19: 0 | G19: 0 | H19: 0 | I19: 0 | J19: 0 | K19: 0 | L19: 0
A20: 38bits_10.dimacs.cnf.out | B20: 37 | C20: 46 | D20: 398 | E20: 308 | F20: =E20/D20 -> 0.77386934673366836 | G20: 0 | H20: 0 | I20: 1 | J20: =I20/D20 -> 2.5125628140703518e-003 | K20: 0 | L20: 0
A21: 40bits_10.dimacs.cnf.out | B21: 34 | C21: 48 | D21: 388 | E21: 264 | F21: =E21/D21 -> 0.68041237113402064 | G21: 0 | H21: 0 | I21: 1 | J21: =I21/D21 -> 2.5773195876288659e-003 | K21: 3 | L21: =K21/D21 -> 7.7319587628865982e-003
A22: 42bits_12.dimacs.cnf.out | B22: 217 | C22: 202 | D22: 460 | E22: 311 | F22: =E22/D22 -> 0.67608695652173911 | G22: 0 | H22: 0 | I22: 1 | J22: =I22/D22 -> 2.1739130434782609e-003 | K22: 37 | L22: =K22/D22 -> 8.0434782608695646e-002
A23: 44bits_11.dimacs.cnf.out | B23: 984 | C23: 3163 | D23: 547 | E23: 392 | F23: =E23/D23 -> 0.71663619744058504 | G23: 0 | H23: 0 | I23: 0 | J23: 0 | K23: 47 | L23: =K23/D23 -> 8.5923217550274225e-002
A24: 46bits_11.dimacs.cnf.out | B24: 3110 | C24: 1723 | D24: 630 | E24: 483 | F24: =E24/D24 -> 0.76666666666666672 | G24: 0 | H24: 0 | I24: 0 | J24: 0 | K24: 0 | L24: 0
A25: 46bits_12.dimacs.cnf.out | B25: 649 | C25: 901 | D25: 625 | E25: 450 | F25: =E25/D25 -> 0.72 | G25: 0 | H25: 0 | I25: 0 | J25: 0 | K25: 4 | L25: =K25/D25 -> 0.0064
A26: 46bits_14.dimacs.cnf.out | B26: 1552 | C26: 2415 | D26: 638 | E26: 467 | F26: =E26/D26 -> 0.73197492163009403 | G26: 0 | H26: 0 | I26: 0 | J26: 0 | K26: 9 | L26: =K26/D26 -> 1.4106583072100314e-002
A27: 48bits_11.dimacs.cnf.out | B27: 5424 | C27: 6053 | D27: 616 | E27: 460 | F27: =E27/D27 -> 0.74675324675324672 | G27: 0 | H27: 0 | I27: 1 | J27: =I27/D27 -> 1.6233766233766235e-003 | K27: 0 | L27: 0
A28: 48bits_12.dimacs.cnf.out | B28: 7310 | C28: 10720 | D28: 619 | E28: 475 | F28: =E28/D28 -> 0.76736672051696286 | G28: 0 | H28: 0 | I28: 1 | J28: =I28/D28 -> 1.6155088852988692e-003 | K28: 13 | L28: =K28/D28 -> 2.10016155088853e-002
A29: 48bits_13.dimacs.cnf.out | B29: 7071 | C29: 9546 | D29: 605 | E29: 433 | F29: =E29/D29 -> 0.71570247933884301 | G29: 0 | H29: 0 | I29: 0 | J29: 0 | K29: 13 | L29: =K29/D29 -> 2.1487603305785124e-002
A30: 48bits_14.dimacs.cnf.out | B30: 6373 | C30: 8663 | D30: 591 | E30: 403 | F30: =E30/D30 -> 0.68189509306260576 | G30: 0 | H30: 0 | I30: 1 | J30: =I30/D30 -> 1.6920473773265651e-003 | K30: 10 | L30: =K30/D30 -> 1.6920473773265651e-002
A31: 50bits_10.dimacs.cnf.out | B31: 9487 | C31: 13680 | D31: 765 | E31: 564 | F31: =E31/D31 -> 0.73725490196078436 | G31: 0 | H31: 0 | I31: 1 | J31: =I31/D31 -> 1.30718954248366e-003 | K31: 11 | L31: =K31/D31 -> 1.4379084967320261e-002
A32: 50bits_11.dimacs.cnf.out | B32: 7287 | C32: 11004 | D32: 738 | E32: 509 | F32: =E32/D32 -> 0.68970189701897022 | G32: 0 | H32: 0 | I32: 1 | J32: =I32/D32 -> 1.3550135501355014e-003 | K32: 25 | L32: =K32/D32 -> 3.3875338753387531e-002
A33: 50bits_13.dimacs.cnf.out | B33: 11727 | C33: 11752 | D33: 729 | E33: 517 | F33: =E33/D33 -> 0.70919067215363507 | G33: 0 | H33: 0 | I33: 1 | J33: =I33/D33 -> 1.3717421124828531e-003 | K33: 3 | L33: =K33/D33 -> 4.11522633744856e-003
A34: 50bits_14.dimacs.cnf.out | B34: 11792 | D34: 832 | E34: 528 | F34: =E34/D34 -> 0.63461538461538458 | G34: 0 | H34: 0 | I34: 1 | J34: =I34/D34 -> 1.201923076923077e-003 | K34: 2 | L34: =K34/D34 -> 2.403846153846154e-003
A35: 5cnf_4300_4300_110.shuffled.cnf.out | B35: 12384 | C35: 10219 | D35: 0 | E35: 0 | F35: 0 | G35: 0 | H35: 0 | I35: 4 | J35: =I35/D35 -> #DIV/0! | K35: 0 | L35: 0
A36: 7cnf20_90000_90000_7.shuffled.cnf.out | B36: 0 | C36: 0 | D36: 2 | E36: 0 | F36: 0 | G36: 0 | H36: 0 | I36: 1 | J36: 0.5 | K36: 0 | L36: 0
A37: aaai10-planning-ipc5-pipesworld-12-step16.cnf.out | B37: 2549 | C37: 3962 | D37: 41539 | E37: 37089 | F37: =E37/D37 -> 0.89287175906978988 | G37: 1 | H37: =G37/D37 -> 2.4073762006788802e-005 | I37: 374 | J37: =I37/D37 -> 9.0035869905390111e-003 | K37: 871 | L37: =K37/D37 -> 2.0968246707913047e-002
A38: aaai10-planning-ipc5-pipesworld-18-step16.cnf.out | B38: 803 | C38: 1211 | D38: 102318 | E38: 96608 | F38: =E38/D38 -> 0.94419359252526436 | G38: 9 | H38: =G38/D38 -> 8.796106256963584e-005 | I38: 245 | J38: =I38/D38 -> 2.3944955921734201e-003 | K38: 268 | L38: =K38/D38 -> 2.6192849742958228e-003
A39: aaai10-planning-ipc5-pipesworld-27-step14.cnf.out | B39: 660 | C39: 843 | D39: 178336 | E39: 167865 | F39: =E39/D39 -> 0.94128499013098865 | G39: 1 | H39: =G39/D39 -> 5.6073927866499197e-006 | I39: 631 | J39: =I39/D39 -> 3.5382648483760991e-003 | K39: 591 | L39: =K39/D39 -> 3.3139691369101021e-003
A40: aaai10-planning-ipc5-rovers-18-step12.cnf.out | B40: 201 | C40: 192 | D40: 6384 | E40: 4760 | F40: =E40/D40 -> 0.74561403508771928 | G40: 43 | H40: =G40/D40 -> 6.7355889724310773e-003 | I40: 212 | J40: =I40/D40 -> 3.3208020050125311e-002 | K40: 284 | L40: =K40/D40 -> 4.4486215538847115e-002
A41: abb313GPIA-9-tr.used-as.sat04-321.cnf.out | B41: 274 | C41: 197 | D41: 953 | E41: 547 | F41: =E41/D41 -> 0.57397691500524661 | G41: 31 | H41: =G41/D41 -> 3.2528856243441762e-002 | I41: 2031 | J41: =I41/D41 -> 2.1311647429171039 | K41: 29 | L41: =K41/D41 -> 3.0430220356768102e-002
A42: ACG-10-10p1.cnf.out | B42: 190 | C42: 205 | D42: 148836 | E42: 140409 | F42: =E42/D42 -> 0.94338063371764891 | G42: 164 | H42: =G42/D42 -> 1.1018839528071165e-003 | I42: 0 | J42: 0 | K42: 125 | L42: =K42/D42 -> 8.3985057378591196e-004
A43: ACG-15-10p1.cnf.out | B43: 2242 | C43: 2390 | D43: 251586 | E43: 237976 | F43: =E43/D43 -> 0.94590319016161473 | G43: 52 | H43: =G43/D43 -> 2.066887664655426e-004 | I43: 0 | J43: 0 | K43: 104 | L43: =K43/D43 -> 4.133775329310852e-004
A44: ACG-15-5p1.cnf.out | B44: 213 | C44: 254 | D44: 203002 | E44: 192625 | F44: =E44/D44 -> 0.94888227702190131 | G44: 215 | H44: =G44/D44 -> 1.059102865981616e-003 | I44: 1 | J44: =I44/D44 -> 4.9260598417749577e-006 | K44: 71 | L44: =K44/D44 -> 3.4975024876602201e-004
A45: ACG-20-10p1.cnf.out | B45: 3990 | C45: 5008 | D45: 360464 | E45: 343803 | F45: =E45/D45 -> 0.95377901815437882 | G45: 68 | H45: =G45/D45 -> 1.886457454835989e-004 | I45: 0 | J45: 0 | K45: 95 | L45: =K45/D45 -> 2.6354920324914556e-004
A46: ACG-20-5p1.cnf.out | B46: 1338 | C46: 1530 | D46: 309772 | E46: 295178 | F46: =E46/D46 -> 0.95288793047789988 | G46: 271 | H46: =G46/D46 -> 8.7483697687331329e-004 | I46: 0 | J46: 0 | K46: 31 | L46: =K46/D46 -> 1.0007360252056351e-004
A47: aes_32_1_keyfind_1.cnf.out | B47: 0 | C47: 0 | D47: 138 | E47: 40 | F47: =E47/D47 -> 0.28985507246376813 | G47: 0 | H47: 0 | I47: 1 | J47: =I47/D47 -> 7.246376811594203e-003 | K47: 0 | L47: 0
A48: AProVE07-11.cnf.out | B48: 644 | C48: 826 | D48: 998962 | E48: 989925 | F48: =E48/D48 -> 0.99095360984702119 | G48: 4 | H48: =G48/D48 -> 4.0041563142541957e-006 | I48: 2 | J48: =I48/D48 -> 2.0020781571270979e-006 | K48: 571 | L48: =K48/D48 -> 5.7159331385978648e-004
A49: AProVE09-06.cnf.out | B49: 3021 | C49: 5357 | D49: 44616 | E49: 41487 | F49: =E49/D49 -> 0.9298682087143626 | G49: 118 | H49: =G49/D49 -> 2.644791106329568e-003 | I49: 1 | J49: =I49/D49 -> 2.2413483951945491e-005 | K49: 1731 | L49: =K49/D49 -> 3.8797740720817646e-002
A50: AProVE09-07.cnf.out | B50: 23 | C50: 28 | D50: 6634 | E50: 6196 | F50: =E50/D50 -> 0.93397648477539941 | G50: 11 | H50: =G50/D50 -> 1.6581248115767259e-003 | I50: 1 | J50: =I50/D50 -> 1.5073861923424781e-004 | K50: 71 | L50: =K50/D50 -> 1.0702441965631596e-002
A51: AProVE09-08.cnf.out | B51: 10 | C51: 13 | D51: 7626 | E51: 7484 | F51: =E51/D51 -> 0.98137949121426693 | G51: 1 | H51: =G51/D51 -> 1.3113034356150013e-004 | I51: 1 | J51: =I51/D51 -> 1.3113034356150013e-004 | K51: 13 | L51: =K51/D51 -> 1.7046944662995017e-003
A52: AProVE09-10.cnf.out | B52: 16 | C52: 12 | D52: 52042 | E52: 49822 | F52: =E52/D52 -> 0.95734214672764306 | G52: 8 | H52: =G52/D52 -> 1.5372199377425925e-004 | I52: 0 | J52: 0 | K52: 113 | L52: =K52/D52 -> 2.1713231620614118e-003
A53: AProVE09-15.cnf.out | B53: 797 | C53: 806 | D53: 33704 | E53: 31626 | F53: =E53/D53 -> 0.93834559696178499 | G53: 12 | H53: =G53/D53 -> 3.5604082601471633e-004 | I53: 1 | J53: =I53/D53 -> 2.9670068834559697e-005 | K53: 287 | L53: =K53/D53 -> 8.5153097555186325e-003
A54: AProVE09-17.cnf.out | B54: 44 | C54: 46 | D54: 22169 | E54: 21402 | F54: =E54/D54 -> 0.96540213812079934 | G54: 0 | H54: 0 | I54: 1 | J54: =I54/D54 -> 4.5108033740809235e-005 | K54: 98 | L54: =K54/D54 -> 4.4205873065993051e-003
A55: AProVE09-19.cnf.out | B55: 12 | C55: 11 | D55: 12836 | E55: 11285 | F55: =E55/D55 -> 0.87916796509816142 | G55: 30 | H55: =G55/D55 -> 2.3371766905578061e-003 | I55: 9 | J55: =I55/D55 -> 7.0115300716734185e-004 | K55: 81 | L55: =K55/D55 -> 6.3103770645060765e-003
A56: AProVE09-20.cnf.out | B56: 1508 | C56: 1991 | D56: 4278 | E56: 2844 | F56: =E56/D56 -> 0.66479663394109401 | G56: 3 | H56: =G56/D56 -> 7.0126227208976155e-004 | I56: 30 | J56: =I56/D56 -> 7.0126227208976155e-003 | K56: 62 | L56: =K56/D56 -> 1.4492753623188406e-002
A57: AProVE09-24.cnf.out | B57: 70 | C57: 85 | D57: 11025 | E57: 6565 | F57: =E57/D57 -> 0.59546485260770976 | G57: 41 | H57: =G57/D57 -> 3.7188208616780044e-003 | I57: 1 | J57: =I57/D57 -> 9.0702947845804991e-005 | K57: 1156 | L57: =K57/D57 -> 0.10485260770975056
A58: AProVE11-05.cnf.out | B58: 3932 | C58: 1311 | D58: 46939 | E58: 43714 | F58: =E58/D58 -> 0.9312938068557064 | G58: 41 | H58: =G58/D58 -> 8.7347408338481864e-004 | I58: 14 | J58: =I58/D58 -> 2.9825944310701125e-004 | K58: 493 | L58: =K58/D58 -> 1.0502993246554038e-002
A59: AProVE11-07.cnf.out | B59: 516 | C59: 450 | D59: 65412 | E59: 53021 | F59: =E59/D59 -> 0.81056992600746036 | G59: 83 | H59: =G59/D59 -> 1.2688803277686052e-003 | I59: 110 | J59: =I59/D59 -> 1.6816486271632116e-003 | K59: 1791 | L59: =K59/D59 -> 2.7380297193175564e-002
A60: AProVE11-08.cnf.out | B60: 284 | C60: 287 | D60: 132563 | E60: 123357 | F60: =E60/D60 -> 0.93055377443177956 | G60: 113 | H60: =G60/D60 -> 8.5242488477176893e-004 | I60: 1 | J60: =I60/D60 -> 7.5435830510776006e-006 | K60: 741 | L60: =K60/D60 -> 5.5897950408485024e-003
A61: AProVE11-09.cnf.out | B61: 85 | C61: 86 | D61: 9450 | E61: 7443 | F61: =E61/D61 -> 0.78761904761904766 | G61: 7 | H61: =G61/D61 -> 7.407407407407407e-004 | I61: 0 | J61: 0 | K61: 601 | L61: =K61/D61 -> 6.3597883597883598e-002
A62: AProVE11-10.cnf.out | B62: 4397 | C62: 4833 | D62: 39193 | E62: 30080 | F62: =E62/D62 -> 0.76748398948791874 | G62: 37 | H62: =G62/D62 -> 9.440461306866022e-004 | I62: 1 | J62: =I62/D62 -> 2.5514760288827087e-005 | K62: 3295 | L62: =K62/D62 -> 8.4071135151685253e-002
A63: AProVE11-12.cnf.out | B63: 16 | C63: 20 | D63: 37030 | E63: 36027 | F63: =E63/D63 -> 0.97291385363219007 | G63: 13 | H63: =G63/D63 -> 3.5106670267350795e-004 | I63: 1 | J63: =I63/D63 -> 2.7005130974885227e-005 | K63: 41 | L63: =K63/D63 -> 1.1072103699702944e-003
A64: AProVE11-16.cnf.out | B64: 49 | C64: 76 | D64: 20453 | E64: 15120 | F64: =E64/D64 -> 0.73925585488681367 | G64: 31 | H64: =G64/D64 -> 1.5156700728499487e-003 | I64: 2 | J64: =I64/D64 -> 9.7785165990319268e-005 | K64: 448 | L64: =K64/D64 -> 2.1903877181831517e-002
A65: bart17.shuffled.cnf.out | B65: 120 | D65: 19863 | E65: 13267 | F65: =E65/D65 -> 0.66792528822433672 | G65: 29 | H65: =G65/D65 -> 1.4600010068972461e-003 | I65: 1 | J65: =I65/D65 -> 5.034486230680159e-005 | K65: 420 | L65: =K65/D65 -> 2.1144842168856669e-002
A66: battleship-10-18-sat.cnf.out | B66: 0 | C66: 1 | D66: 0 | E66: 0 | F66: 0 | G66: 0 | H66: 0 | I66: 0 | J66: 0 | K66: 0 | L66: 0
A67: battleship-10-19-sat.cnf.out | B67: 0 | C67: 1 | D67: 0 | E67: 0 | F67: 0 | G67: 0 | H67: 0 | I67: 0 | J67: 0 | K67: 0 | L67: 0
A68: battleship-14-14-unsat.cnf.out | B68: 3839
A69: battleship-14-27-sat.cnf.out | B69: 2679 | C69: 5054 | D69: 0 | E69: 0 | F69: 0 | G69: 0 | H69: 0 | I69: 0 | J69: 0 | K69: 0 | L69: 0
A70: battleship-7-13-sat.cnf.out | B70: 2 | C70: 0 | D70: 0 | E70: 0 | F70: 0 | G70: 0 | H70: 0 | I70: 0 | J70: 0 | K70: 0 | L70: 0
A71: clauses-4.cnf.out | B71: 121 | C71: 260 | D71: 241299 | E71: 237194 | F71: =E71/D71 -> 0.98298791126361895 | G71: 365 | H71: =G71/D71 -> 1.5126461361215753e-003 | I71: 1 | J71: =I71/D71 -> 4.1442359893741786e-006 | K71: 614 | L71: =K71/D71 -> 2.544560897475746e-003
A72: complete-300-0.1-18-98765432130018.cnf.out | B72: 2362 | C72: 2878 | D72: 256 | E72: 4 | F72: =E72/D72 -> 0.015625 | G72: 0 | H72: 0 | I72: 1 | J72: =I72/D72 -> 0.00390625 | K72: 0 | L72: 0
A73: complete-300-0.1-4-9876543213004.cnf.out | B73: 2076 | C73: 2903 | D73: 276 | E73: 16 | F73: =E73/D73 -> 5.7971014492753624e-002 | G73: 0 | H73: 0 | I73: 1 | J73: =I73/D73 -> 3.6231884057971015e-003 | K73: 0 | L73: 0
A74: complete-300-0.1-7-9876543213007.cnf.out | B74: 3135 | C74: 4075 | D74: 275 | E74: 14 | F74: =E74/D74 -> 5.0909090909090911e-002 | G74: 0 | H74: 0 | I74: 1 | J74: =I74/D74 -> 3.6363636363636364e-003 | K74: 0 | L74: 0
A75: complete-300-0.1-8-9876543213008.cnf.out | B75: 3212 | C75: 3272 | D75: 252 | E75: 2 | F75: =E75/D75 -> 7.9365079365079361e-003 | G75: 0 | H75: 0 | I75: 1 | J75: =I75/D75 -> 3.968253968253968e-003 | K75: 0 | L75: 0
A76: Composite-024BitPrimes-1.used-as.sat04-861.cnf.out | B76: 347 | C76: 499 | D76: 787 | E76: 370 | F76: =E76/D76 -> 0.47013977128335449 | G76: 0 | H76: 0 | I76: 0 | J76: 0 | K76: 31 | L76: =K76/D76 -> 3.9390088945362133e-002
A77: crn_11_100_s.cnf.out | B77: 232 | C77: 330 | D77: 1300 | E77: 469 | F77: =E77/D77 -> 0.36076923076923079 | G77: 89 | H77: =G77/D77 -> 6.8461538461538463e-002 | I77: 1 | J77: =I77/D77 -> 7.6923076923076923e-004 | K77: 0 | L77: 0
A78: cube-11-h14-sat.cnf.out | B78: 997 | C78: 1241 | D78: 508177 | E78: 508086 | F78: =E78/D78 -> 0.9998209285347428 | G78: 7 | H78: =G78/D78 -> 1.3774728096706462e-005 | I78: 0 | J78: 0 | K78: 24 | L78: =K78/D78 -> 4.722763918870787e-005
A79: cube-9-h11-sat.cnf.out | B79: 301 | C79: 275 | D79: 208292 | E79: 208221 | F79: =E79/D79 -> 0.99965913237186255 | G79: 5 | H79: =G79/D79 -> 2.4004762544888906e-005 | I79: 0 | J79: 0 | K79: 30 | L79: =K79/D79 -> 1.4402857526933343e-004
A80: dated-10-13-s.cnf.out | B80: 11617 | C80: 15110 | D80: 175579 | E80: 171328 | F80: =E80/D80 -> 0.97578867632233923 | G80: 112 | H80: =G80/D80 -> 6.3788949703552243e-004 | I80: 1 | J80: =I80/D80 -> 5.6954419378171646e-006 | K80: 51 | L80: =K80/D80 -> 2.904675388286754e-004
A81: dp04s04.shuffled.cnf.out | B81: 0 | C81: 0 | D81: 743 | E81: 609 | F81: =E81/D81 -> 0.81965006729475098 | G81: 7 | H81: =G81/D81 -> 9.4212651413189772e-003 | I81: 1 | J81: =I81/D81 -> 1.3458950201884253e-003 | K81: 3 | L81: =K81/D81 -> 4.0376850605652759e-003
A82: dp10s10.shuffled.cnf.out | B82: 237 | C82: 193 | D82: 4891 | E82: 4167 | F82: =E82/D82 -> 0.85197301165405848 | G82: 15 | H82: =G82/D82 -> 3.066857493355142e-003 | I82: 1 | J82: =I82/D82 -> 2.0445716622367614e-004 | K82: 69 | L82: =K82/D82 -> 1.4107544469433653e-002
A83: E03X18.cnf.out | B83: 62 | C83: 124 | D83: 5122 | E83: 4335 | F83: =E83/D83 -> 0.84634908238969153 | G83: 0 | H83: 0 | I83: 0 | J83: 0 | K83: 266 | L83: =K83/D83 -> 5.1932838734869188e-002
A84: E05F18.cnf.out | B84: 1744 | C84: 1655 | D84: 3603 | E84: 2810 | F84: =E84/D84 -> 0.77990563419372749 | G84: 0 | H84: 0 | I84: 1 | J84: =I84/D84 -> 2.7754648903691371e-004 | K84: 381 | L84: =K84/D84 -> 0.10574521232306411
A85: een-tip-sat-nusmv-t5.B.cnf.out | B85: 6 | C85: 9 | D85: 33073 | E85: 27642 | F85: =E85/D85 -> 0.8357875003779518 | G85: 98 | H85: =G85/D85 -> 2.9631421401142928e-003 | I85: 37 | J85: =I85/D85 -> 1.1187373386145798e-003 | K85: 0 | L85: 0
A86: em_12_2_4_cmp.cnf.out | B86: 2747 | D86: 78 | E86: 0 | F86: 0 | G86: 0 | H86: 0 | I86: 0 | J86: 0.019230769 | K86: 0 | L86: 0
A87: em_8_4_5_all.cnf.out | B87: 2427 | C87: 3616 | D87: 52 | E87: 0 | F87: 0 | G87: 0 | H87: 0 | I87: 0 | J87: 0.019230769 | K87: 0 | L87: 0
A88: emptyroom-4-h21-unsat.cnf.out | B88: 2427 | D88: 69823 | E88: 64872 | F88: =E88/D88 -> 0.92909213296478232 | G88: 2 | H88: =G88/D88 -> 2.8643856608853816e-005 | I88: 0 | J88: 0 | K88: 53 | L88: =K88/D88 -> 7.5906220013462612e-004
A89: emptyroom-4-h22-sat.cnf.out | B89: 3208 | C89: 2719 | D89: 73770 | E89: 73679 | F89: =E89/D89 -> 0.99876643622068595 | G89: 3 | H89: =G89/D89 -> 4.0666937779585194e-005 | I89: 0 | J89: 0 | K89: 53 | L89: =K89/D89 -> 7.1844923410600511e-004
A90: g2-ACG-15-10p1.cnf.out | B90: 2139 | C90: 2380 | D90: 251586 | E90: 237976 | F90: =E90/D90 -> 0.94590319016161473 | G90: 52 | H90: =G90/D90 -> 2.066887664655426e-004 | I90: 0 | J90: 0 | K90: 104 | L90: =K90/D90 -> 4.133775329310852e-004
A91: g2-ACG-20-10p1.cnf.out | B91: 3502 | C91: 4871 | D91: 360464 | E91: 343803 | F91: =E91/D91 -> 0.95377901815437882 | G91: 68 | H91: =G91/D91 -> 1.886457454835989e-004 | I91: 0 | J91: 0 | K91: 95 | L91: =K91/D91 -> 2.6354920324914556e-004
A92: g2-ACG-20-5p1.cnf.out | B92: 1332 | C92: 1609 | D92: 309772 | E92: 295178 | F92: =E92/D92 -> 0.95288793047789988 | G92: 271 | H92: =G92/D92 -> 8.7483697687331329e-004 | I92: 0 | J92: 0 | K92: 31 | L92: =K92/D92 -> 1.0007360252056351e-004
A93: g2-mult1.c.50.smt2-cvc4.cnf.out | B93: 8173 | C93: 8526 | D93: 3993 | E93: 2037 | F93: =E93/D93 -> 0.51014274981217134 | G93: 0 | H93: 0 | I93: 1 | J93: =I93/D93 -> 2.5043826696719256e-004 | K93: 3 | L93: =K93/D93 -> 7.513148009015778e-004
A94: g2-UCG-15-10p1.cnf.out | B94: 1054 | C94: 1331 | D94: 183337 | E94: 170400 | F94: =E94/D94 -> 0.9294359567354108 | G94: 140 | H94: =G94/D94 -> 7.6362109121453931e-004 | I94: 0 | J94: 0 | K94: 60 | L94: =K94/D94 -> 3.2726618194908828e-004
A95: g2-UCG-20-5p1.cnf.out | B95: 975 | C95: 1307 | D95: 203571 | E95: 190182 | F95: =E95/D95 -> 0.93422933521965312 | G95: 191 | H95: =G95/D95 -> 9.3824758929317049e-004 | I95: 0 | J95: 0 | K95: 81 | L95: =K95/D95 -> 3.9789557451699897e-004
A96: g2-UR-20-5p1.cnf.out | B96: 3883 | C96: 8564 | D96: 202860 | E96: 188657 | F96: =E96/D96 -> 0.92998619737750177 | G96: 183 | H96: =G96/D96 -> 9.020999704229518e-004 | I96: 0 | J96: 0 | K96: 286 | L96: =K96/D96 -> 1.4098392980380558e-003
A97: gcdmax16bits_22.cnf.out | B97: 567 | C97: 1176 | D97: 129652 | E97: 128916 | F97: =E97/D97 -> 0.99432326535649274 | G97: 0 | H97: 0 | I97: 0 | J97: 0 | K97: 14 | L97: =K97/D97 -> 1.0798136550149632e-004
A98: gensys-brn002.shuffled-as.sat05-3935.cnf.out | B98: 97 | C98: 197 | D98: 56 | E98: 10 | F98: =E98/D98 -> 0.17857142857142858 | G98: 11 | H98: =G98/D98 -> 0.19642857142857142 | I98: 143 | J98: =I98/D98 -> 2.5535714285714284 | K98: 0 | L98: 0
A99: GreenTao_2-3-5_527.cnf.out | B99: 541 | C99: 526 | D99: 252 | E99: 198 | F99: =E99/D99 -> 0.7857142857142857 | G99: 0 | H99: 0 | I99: 65 | J99: =I99/D99 -> 0.25793650793650796 | K99: 28 | L99: =K99/D99 -> 0.1111111111111111
A100: grieu-vmpc-27.cnf.out | B100: 102 | C100: 213 | D100: 677 | E100: 36 | F100: =E100/D100 -> 5.3175775480059084e-002 | G100: 0 | H100: 0 | I100: 1 | J100: =I100/D100 -> 1.4771048744460858e-003 | K100: 0 | L100: 0
A101: grieu-vmpc-31.cnf.out | B101: 1889 | C101: 2245 | D101: 961 | E101: 793 | F101: =E101/D101 -> 0.82518210197710717 | G101: 0 | H101: 0 | I101: 1 | J101: =I101/D101 -> 1.0405827263267431e-003 | K101: 32 | L101: =K101/D101 -> 3.3298647242455778e-002
A102: gss-14-s100.cnf.out | B102: 59 | C102: 67 | D102: 31229 | E102: 31214 | F102: =E102/D102 -> 0.99951967722309387 | G102: 1 | H102: =G102/D102 -> 3.202151846040539e-005 | I102: 1 | J102: =I102/D102 -> 3.202151846040539e-005 | K102: 4 | L102: =K102/D102 -> 1.2808607384162156e-004
A103: gss-15-s100.cnf.out | B103: 123 | C103: 137 | D103: 31238 | E103: 31222 | F103: =E103/D103 -> 0.99948780331647358 | G103: 1 | H103: =G103/D103 -> 3.2012292720404635e-005 | I103: 1 | J103: =I103/D103 -> 3.2012292720404635e-005 | K103: 4 | L103: =K103/D103 -> 1.2804917088161854e-004
A104: gss-16-s100.cnf.out | B104: 272 | C104: 272 | D104: 31248 | E104: 31232 | F104: =E104/D104 -> 0.99948796722990274 | G104: 0 | H104: 0 | I104: 1 | J104: =I104/D104 -> 3.2002048131080389e-005 | K104: 4 | L104: =K104/D104 -> 1.2800819252432156e-004
A105: gss-17-s100.cnf.out | B105: 510 | C105: 612 | D105: 31318 | E105: 31301 | F105: =E105/D105 -> 0.99945718117376592 | G105: 0 | H105: 0 | I105: 1 | J105: =I105/D105 -> 3.1930519190242035e-005 | K105: 4 | L105: =K105/D105 -> 1.2772207676096814e-004
A106: gss-18-s100.cnf.out | B106: 2319 | C106: 2693 | D106: 31364 | E106: 31346 | F106: =E106/D106 -> 0.99942609361050883 | G106: 0 | H106: 0 | I106: 1 | J106: =I106/D106 -> 3.1883688305063132e-005 | K106: 6 | L106: =K106/D106 -> 1.9130212983037878e-004
A107: gss-19-s100.cnf.out | B107: 6716 | C107: 9237 | D107: 31435 | E107: 31416 | F107: =E107/D107 -> 0.99939557817719105 | G107: 0 | H107: 0 | I107: 1 | J107: =I107/D107 -> 3.1811674884682675e-005 | K107: 5 | L107: =K107/D107 -> 1.590583744234134e-004
A108: IBM_FV_2004_rule_batch_01_SAT_dat.k100.cnf.out | B108: 17387 | D108: 14028 | E108: 1924 | F108: =E108/D108 -> 0.13715426290276589 | G108: 2 | H108: =G108/D108 -> 1.4257199885942402e-004 | I108: 625 | J108: =I108/D108 -> 4.455374964357e-002 | K108: 16 | L108: =K108/D108 -> 1.1405759908753922e-003
A109: IBM_FV_2004_rule_batch_01_SAT_dat.k95.cnf.out | B109: 4331 | D109: 9475 | E109: 1135 | F109: =E109/D109 -> 0.11978891820580474 | G109: 33 | H109: =G109/D109 -> 3.4828496042216359e-003 | I109: 554 | J109: =I109/D109 -> 5.846965699208443e-002 | K109: 16 | L109: =K109/D109 -> 1.6886543535620053e-003
A110: IBM_FV_2004_rule_batch_23_SAT_dat.k90.cnf.out | B110: 498 | D110: 41027 | E110: 30153 | F110: =E110/D110 -> 0.73495502961464398 | G110: 122 | H110: =G110/D110 -> 2.9736514977941357e-003 | I110: 576 | J110: =I110/D110 -> 1.4039534940405099e-002 | K110: 559 | L110: =K110/D110 -> 1.3625173666122309e-002
A111: ibm-2002-21r-k95.cnf.out | B111: 8610 | C111: 6271 | D111: 31089 | E111: 18447 | F111: =E111/D111 -> 0.59336099585062241 | G111: 36 | H111: =G111/D111 -> 1.1579658400077198e-003 | I111: 59 | J111: =I111/D111 -> 1.8977773489015407e-003 | K111: 42 | L111: =K111/D111 -> 1.3509601466756731e-003
A112: iso-ukn004.shuffled-as.sat05-3385.cnf.out | B112: 0 | C112: 0 | D112: 500 | E112: 263 | F112: =E112/D112 -> 0.526 | G112: 25 | H112: =G112/D112 -> 0.05 | I112: 17 | J112: =I112/D112 -> 0.034 | K112: 0 | L112: 0
A113: iso-ukn009.shuffled-as.sat05-3632.cnf.out | B113: 0 | C113: 0 | D113: 682 | E113: 430 | F113: =E113/D113 -> 0.63049853372434017 | G113: 31 | H113: =G113/D113 -> 4.5454545454545456e-002 | I113: 28 | J113: =I113/D113 -> 4.1055718475073312e-002 | K113: 0 | L113: 0
A114: itox_vc1044.cnf.out | B114: 482 | D114: 764 | E114: 429 | F114: =E114/D114 -> 0.56151832460732987 | G114: 29 | H114: =G114/D114 -> 3.7958115183246072e-002 | I114: 27 | J114: =I114/D114 -> 3.5340314136125657e-002 | K114: 0 | L114: 0
A115: lksat-n1100-m4103-k3-l5-s558351420.used-as.sat04-934.cnf.out | B115: 3365 | C115: 4680 | D115: 31 | E115: 0 | F115: 0 | G115: 0 | H115: 0 | I115: 251 | J115: =I115/D115 -> 8.0967741935483879 | K115: 0 | L115: 0
A116: lksat-n900-m3357-k3-l5-s950595579.used-as.sat04-938.cnf.out | B116: 1863 | C116: 1737 | D116: 15 | E116: 0 | F116: 0 | G116: 0 | H116: 0 | I116: 226 | J116: =I116/D116 -> 15.066666666666666 | K116: 0 | L116: 0
A117: lksat-n900-m6174-k4-l4-s819398222.used-as.sat04-929.cnf.out | B117: 232 | C117: 286 | D117: 4 | E117: 0 | F117: 0 | G117: 0 | H117: 0 | I117: 126 | J117: =I117/D117 -> 31.5 | K117: 0 | L117: 0
A118: manthey_DimacsSorter_28_0.cnf.out | B118: 297 | C118: 18 | D118: 3985 | E118: 3943 | F118: =E118/D118 -> 0.98946047678795479 | G118: 0 | H118: 0 | I118: 0 | J118: 0 | K118: 3 | L118: =K118/D118 -> 7.5282308657465501e-004
A119: manthey_DimacsSorter_28_3.cnf.out | B119: 131 | C119: 113 | D119: 3552 | E119: 3481 | F119: =E119/D119 -> 0.98001126126126126 | G119: 0 | H119: 0 | I119: 0 | J119: 0 | K119: 34 | L119: =K119/D119 -> 9.5720720720720714e-003
A120: manthey_DimacsSorter_28_4.cnf.out | B120: 297 | C120: 285 | D120: 3665 | E120: 3584 | F120: =E120/D120 -> 0.97789904502046388 | G120: 0 | H120: 0 | I120: 0 | J120: 0 | K120: 13 | L120: =K120/D120 -> 3.5470668485675307e-003
A121: manthey_DimacsSorter_28_7.cnf.out | B121: 124 | C121: 80 | D121: 3506 | E121: 3421 | F121: =E121/D121 -> 0.97575584711922414 | G121: 0 | H121: 0 | I121: 0 | J121: 0 | K121: 21 | L121: =K121/D121 -> 5.9897318881916711e-003
A122: manthey_DimacsSorter_29_8.cnf.out | B122: 57 | D122: 6559 | E122: 3984 | F122: =E122/D122 -> 0.60740966610763836 | G122: 0 | H122: 0 | I122: 0 | J122: 0 | K122: 30 | L122: =K122/D122 -> 4.5738679676779999e-003
A123: manthey_DimacsSorter_30_1.cnf.out | B123: 152 | C123: 58 | D123: 3605 | E123: 3552 | F123: =E123/D123 -> 0.98529819694868237 | G123: 0 | H123: 0 | I123: 0 | J123: 0 | K123: 12 | L123: =K123/D123 -> 3.3287101248266299e-003
A124: manthey_DimacsSorter_30_4.cnf.out | B124: 166 | C124: 256 | D124: 3722 | E124: 3658 | F124: =E124/D124 -> 0.98280494357872117 | G124: 0 | H124: 0 | I124: 0 | J124: 0 | K124: 23 | L124: =K124/D124 -> 6.1794734013970983e-003
A125: manthey_DimacsSorter_30_5.cnf.out | B125: 187 | C125: 284 | D125: 3842 | E125: 3766 | F125: =E125/D125 -> 0.98021863612701721 | G125: 0 | H125: 0 | I125: 0 | J125: 0 | K125: 22 | L125: =K125/D125 -> 5.726184279021343e-003
A126: manthey_DimacsSorter_30_6.cnf.out | B126: 141 | C126: 118 | D126: 3637 | E126: 3557 | F126: =E126/D126 -> 0.97800384932636786 | G126: 0 | H126: 0 | I126: 0 | J126: 0 | K126: 24 | L126: =K126/D126 -> 6.598845202089634e-003
A127: manthey_DimacsSorter_31_0.cnf.out | B127: 10020 | C127: 10744 | D127: 612 | E127: 402 | F127: =E127/D127 -> 0.65686274509803921 | G127: 2 | H127: =G127/D127 -> 3.2679738562091504e-003 | I127: 1 | J127: =I127/D127 -> 1.6339869281045752e-003 | K127: 201 | L127: =K127/D127 -> 0.32843137254901961
A128: manthey_DimacsSorter_31_4.cnf.out | B128: 14965 | D128: 756 | E128: 389 | F128: =E128/D128 -> 0.51455026455026454 | G128: 2 | H128: =G128/D128 -> 2.6455026455026454e-003 | I128: 1 | J128: =I128/D128 -> 1.3227513227513227e-003 | K128: 187 | L128: =K128/D128 -> 0.24735449735449735
A129: manthey_DimacsSorter_31_6.cnf.out | B129: 3960 | C129: 5013 | D129: 439 | E129: 268 | F129: =E129/D129 -> 0.61047835990888377 | G129: 0 | H129: 0 | I129: 1 | J129: =I129/D129 -> 2.2779043280182231e-003 | K129: 134 | L129: =K129/D129 -> 0.30523917995444189
A130: manthey_DimacsSorter_32_1.cnf.out | B130: 5700 | C130: 5745 | D130: 3008 | E130: 2709 | F130: =E130/D130 -> 0.90059840425531912 | G130: 1 | H130: =G130/D130 -> 3.3244680851063829e-004 | I130: 1 | J130: =I130/D130 -> 3.3244680851063829e-004 | K130: 58 | L130: =K130/D130 -> 1.9281914893617021e-002
A131: manthey_DimacsSorter_35_1.cnf.out | B131: 1887 | C131: 2144 | D131: 6944 | E131: 6835 | F131: =E131/D131 -> 0.98430299539170507 | G131: 0 | H131: 0 | I131: 0 | J131: 0 | K131: 53 | L131: =K131/D131 -> 7.6324884792626727e-003
A132: manthey_DimacsSorter_35_7.cnf.out | B132: 792 | C132: 772 | D132: 6837 | E132: 6732 | F132: =E132/D132 -> 0.98464238701184725 | G132: 0 | H132: 0 | I132: 0 | J132: 0 | K132: 49 | L132: =K132/D132 -> 7.1668860611379262e-003
A133: manthey_DimacsSorter_35_8.cnf.out | B133: 10009 | C133: 9327 | D133: 7246 | E133: 7119 | F133: =E133/D133 -> 0.98247308860060723 | G133: 0 | H133: 0 | I133: 0 | J133: 0 | K133: 53 | L133: =K133/D133 -> 7.3143803477780846e-003
A134: manthey_DimacsSorter_36_7.cnf.out | B134: 19 | D134: 7653 | E134: 7213 | F134: =E134/D134 -> 0.94250620671632035 | G134: 0 | H134: 0 | I134: 0 | J134: 0 | K134: 56 | L134: =K134/D134 -> 7.3173918724683132e-003
A135: manthey_DimacsSorter_37_3.cnf.out | B135: 131 | D135: 7862 | E135: 7309 | F135: =E135/D135 -> 0.92966166369880443 | G135: 0 | H135: 0 | I135: 0 | J135: 0 | K135: 60 | L135: =K135/D135 -> 7.6316458916306281e-003
A136: manthey_DimacsSorter_37_6.cnf.out | B136: 262 | D136: 7132 | E136: 7098 | F136: =E136/D136 -> 0.99523275378575438 | G136: 0 | H136: 0 | I136: 0 | J136: 0 | K136: 46 | L136: =K136/D136 -> 6.4498037016264718e-003
A137: manthey_DimacsSorterHalf_28_4.cnf.out | B137: 68 | C137: 293 | D137: 3665 | E137: 3584 | F137: =E137/D137 -> 0.97789904502046388 | G137: 0 | H137: 0 | I137: 0 | J137: 0 | K137: 13 | L137: =K137/D137 -> 3.5470668485675307e-003
A138: manthey_DimacsSorterHalf_29_8.cnf.out | B138: 58 | D138: 3287 | E138: 2963 | F138: =E138/D138 -> 0.90142987526620022 | G138: 0 | H138: 0 | I138: 0 | J138: 0 | K138: 9 | L138: =K138/D138 -> 2.7380590203833284e-003
A139: manthey_DimacsSorterHalf_30_0.cnf.out | B139: 166 | C139: 133 | D139: 3567 | E139: 3465 | F139: =E139/D139 -> 0.97140454163162326 | G139: 0 | H139: 0 | I139: 0 | J139: 0 | K139: 63 | L139: =K139/D139 -> 1.7661900756938603e-002
A140: manthey_DimacsSorterHalf_30_3.cnf.out | B140: 187 | C140: 58 | D140: 3739 | E140: 3692 | F140: =E140/D140 -> 0.98742979406258358 | G140: 0 | H140: 0 | I140: 0 | J140: 0 | K140: 7 | L140: =K140/D140 -> 1.8721583311045735e-003
A141: manthey_DimacsSorterHalf_30_7.cnf.out | B141: 143 | C141: 271 | D141: 3507 | E141: 3348 | F141: =E141/D141 -> 0.95466210436270316 | G141: 0 | H141: 0 | I141: 0 | J141: 0 | K141: 47 | L141: =K141/D141 -> 1.3401767892785858e-002
A142: manthey_DimacsSorterHalf_31_2.cnf.out | B142: 11316 | D142: 3207 | E142: 2485 | F142: =E142/D142 -> 0.77486747739320239 | G142: 1 | H142: =G142/D142 -> 3.1181789834736512e-004 | I142: 1 | J142: =I142/D142 -> 3.1181789834736512e-004 | K142: 46 | L142: =K142/D142 -> 1.4343623323978797e-002
A143: manthey_DimacsSorterHalf_32_1.cnf.out | B143: 4977 | C143: 5694 | D143: 3008 | E143: 2709 | F143: =E143/D143 -> 0.90059840425531912 | G143: 1 | H143: =G143/D143 -> 3.3244680851063829e-004 | I143: 1 | J143: =I143/D143 -> 3.3244680851063829e-004 | K143: 58 | L143: =K143/D143 -> 1.9281914893617021e-002
A144: manthey_DimacsSorterHalf_35_8.cnf.out | B144: 4425 | C144: 9415 | D144: 7246 | E144: 7119 | F144: =E144/D144 -> 0.98247308860060723 | G144: 0 | H144: 0 | I144: 0 | J144: 0 | K144: 53 | L144: =K144/D144 -> 7.3143803477780846e-003
A145: manthey_DimacsSorterHalf_35_9.cnf.out | B145: 1950 | C145: 12576 | D145: 8299 | E145: 8144 | F145: =E145/D145 -> 0.98132305096999639 | G145: 0 | H145: 0 | I145: 0 | J145: 0 | K145: 55 | L145: =K145/D145 -> 6.6273044945174119e-003
A146: manthey_DimacsSorterHalf_36_0.cnf.out | B146: 851 | D146: 8307 | E146: 8021 | F146: =E146/D146 -> 0.96557120500782467 | G146: 0 | H146: 0 | I146: 0 | J146: 0 | K146: 47 | L146: =K146/D146 -> 5.6578788973155169e-003
A147: manthey_DimacsSorterHalf_36_7.cnf.out | B147: 13355 | D147: 8421 | E147: 8156 | F147: =E147/D147 -> 0.96853105331908329 | G147: 0 | H147: 0 | I147: 0 | J147: 0 | K147: 52 | L147: =K147/D147 -> 6.1750385939912129e-003
A148: manthey_single-ordered-initialized-w12-b6.cnf.out | B148: 0 | C148: 0 | D148: 792 | E148: 768 | F148: =E148/D148 -> 0.96969696969696972 | G148: 0 | H148: 0 | I148: 1 | J148: =I148/D148 -> 1.2626262626262627e-003 | K148: 0 | L148: 0
A149: manthey_single-ordered-initialized-w14-b7.cnf.out | B149: 0 | C149: 0 | D149: 1225 | E149: 1186 | F149: =E149/D149 -> 0.9681632653061224 | G149: 0 | H149: 0 | I149: 1 | J149: =I149/D149 -> 8.1632653061224493e-004 | K149: 23 | L149: =K149/D149 -> 1.8775510204081632e-002
A150: manthey_single-ordered-initialized-w20-b10.cnf.out | B150: 0 | C150: 0 | D150: 3400 | E150: 3330 | F150: =E150/D150 -> 0.97941176470588232 | G150: 0 | H150: 0 | I150: 1 | J150: =I150/D150 -> 2.941176470588235e-004 | K150: 9 | L150: =K150/D150 -> 2.6470588235294116e-003
A151: manthey_single-ordered-initialized-w48-b8.cnf.out | B151: 1780 | C151: 1617 | D151: 1911 | E151: 1376 | F151: =E151/D151 -> 0.72004186289900574 | G151: 17 | H151: =G151/D151 -> 8.8958660387231814e-003 | I151: 1 | J151: =I151/D151 -> 5.2328623757195189e-004 | K151: 87 | L151: =K151/D151 -> 4.5525902668759811e-002
A152: mp1-21.3.cnf.out | B152: 13976 | D152: 14672 | E152: 10573 | F152: =E152/D152 -> 0.7206243184296619 | G152: 60 | H152: =G152/D152 -> 4.0894220283533263e-003 | I152: 0 | J152: 0 | K152: 35 | L152: =K152/D152 -> 2.3854961832061069e-003
A153: mp1-21.9.cnf.out | B153: 10924 | D153: 15879 | E153: 9872 | F153: =E153/D153 -> 0.6217016184898293 | G153: 62 | H153: =G153/D153 -> 3.904527992946659e-003 | I153: 0 | J153: 0 | K153: 36 | L153: =K153/D153 -> 2.2671452862270923e-003
A154: mp1-9_1.cnf.out | B154: 3268 | C154: 6605 | D154: 1398 | E154: 969 | F154: =E154/D154 -> 0.69313304721030045 | G154: 55 | H154: =G154/D154 -> 3.9341917024320459e-002 | I154: 0 | J154: 0 | K154: 40 | L154: =K154/D154 -> 2.8612303290414878e-002
A155: mp1-9_11.cnf.out | B155: 326 | C155: 382 | D155: 1216 | E155: 637 | F155: =E155/D155 -> 0.52384868421052633 | G155: 42 | H155: =G155/D155 -> 3.453947368421053e-002 | I155: 1 | J155: =I155/D155 -> 8.2236842105263153e-004 | K155: 55 | L155: =K155/D155 -> 4.5230263157894739e-002
A156: mp1-9_27.cnf.out | B156: 2267 | C156: 4041 | D156: 1139 | E156: 600 | F156: =E156/D156 -> 0.52677787532923614 | G156: 43 | H156: =G156/D156 -> 3.7752414398595259e-002 | I156: 1 | J156: =I156/D156 -> 8.7796312554872696e-004 | K156: 73 | L156: =K156/D156 -> 6.4091308165057065e-002
A157: mp1-9_29.cnf.out | B157: 706 | C157: 1729 | D157: 1313 | E157: 779 | F157: =E157/D157 -> 0.5932977913175933 | G157: 57 | H157: =G157/D157 -> 4.3412033511043412e-002 | I157: 1 | J157: =I157/D157 -> 7.6161462300076163e-004 | K157: 63 | L157: =K157/D157 -> 4.7981721249047982e-002
A158: mp1-9_3.cnf.out | B158: 58 | C158: 69 | D158: 1374 | E158: 1002 | F158: =E158/D158 -> 0.72925764192139741 | G158: 51 | H158: =G158/D158 -> 3.7117903930131008e-002 | I158: 0 | J158: 0 | K158: 25 | L158: =K158/D158 -> 1.8195050946142648e-002
A159: mp1-9_38.cnf.out | B159: 41 | C159: 41 | D159: 1163 | E159: 685 | F159: =E159/D159 -> 0.58899398108340495 | G159: 52 | H159: =G159/D159 -> 4.471195184866724e-002 | I159: 0 | J159: 0 | K159: 28 | L159: =K159/D159 -> 2.407566638005159e-002
A160: mp1-klieber2017s-0490-022-t12.cnf.out | B160: 722 | C160: 1078 | D160: 29873 | E160: 29851 | F160: =E160/D160 -> 0.99926354902420245 | G160: 0 | H160: 0 | I160: 0 | J160: 0 | K160: 20 | L160: =K160/D160 -> 6.6950088708867537e-004
A161: mp1-klieber2017s-0490-023-t12.cnf.out | B161: 3085 | C161: 3174 | D161: 30833 | E161: 30810 | F161: =E161/D161 -> 0.99925404598968637 | G161: 0 | H161: 0 | I161: 1 | J161: =I161/D161 -> 3.243278305711413e-005 | K161: 19 | L161: =K161/D161 -> 6.1622287808516852e-004
A162: mp1-klieber2017s-0490-024-t12.cnf.out | B162: 4210 | C162: 5235 | D162: 30503 | E162: 30479 | F162: =E162/D162 -> 0.9992131921450349 | G162: 0 | H162: 0 | I162: 0 | J162: 0 | K162: 19 | L162: =K162/D162 -> 6.2288955184735932e-004
A163: mp1-klieber2017s-0500-022-t12.cnf.out | B163: 660 | C163: 554 | D163: 30894 | E163: 30872 | F163: =E163/D163 -> 0.9992878876157183 | G163: 0 | H163: 0 | I163: 1 | J163: =I163/D163 -> 3.2368744740078979e-005 | K163: 19 | L163: =K163/D163 -> 6.1500615006150063e-004
A164: mp1-klieber2017s-0500-023-t12.cnf.out | B164: 1414 | C164: 1339 | D164: 30587 | E164: 30564 | F164: =E164/D164 -> 0.9992480465557263 | G164: 0 | H164: 0 | I164: 0 | J164: 0 | K164: 19 | L164: =K164/D164 -> 6.2117893222610914e-004
A165: mp1-klieber2017s-0500-024-t12.cnf.out | B165: 3011 | C165: 5158 | D165: 30935 | E165: 30911 | F165: =E165/D165 -> 0.99922417973169553 | G165: 0 | H165: 0 | I165: 1 | J165: =I165/D165 -> 3.2325844512687896e-005 | K165: 20 | L165: =K165/D165 -> 6.4651689025375784e-004
A166: mp1-qpr-bmp280-driver-5.cnf.out | B166: 2406 | C166: 1702 | D166: 2911 | E166: 1927 | F166: =E166/D166 -> 0.6619718309859155 | G166: 3 | H166: =G166/D166 -> 1.0305736860185502e-003 | I166: 11 | J166: =I166/D166 -> 3.7787701820680177e-003 | K166: 5 | L166: =K166/D166 -> 1.7176228100309172e-003
A167: mp1-rubikcube612.cnf.out | B167: 12079 | C167: 12417 | D167: 2505 | E167: 957 | F167: =E167/D167 -> 0.38203592814371257 | G167: 5 | H167: =G167/D167 -> 1.996007984031936e-003 | I167: 6 | J167: =I167/D167 -> 2.3952095808383233e-003 | K167: 68 | L167: =K167/D167 -> 2.714570858283433e-002
A168: mrpp_4x4#10_20.cnf.out | B168: 952 | C168: 1534 | D168: 405 | E168: 129 | F168: =E168/D168 -> 0.31851851851851853 | G168: 0 | H168: 0 | I168: 13 | J168: =I168/D168 -> 3.2098765432098768e-002 | K168: 0 | L168: 0
A169: mrpp_4x4#10_9.cnf.out | B169: 5 | C169: 4 | D169: 1487 | E169: 803 | F169: =E169/D169 -> 0.54001344989912581 | G169: 0 | H169: 0 | I169: 3 | J169: =I169/D169 -> 2.0174848688634837e-003 | K169: 5 | L169: =K169/D169 -> 3.3624747814391394e-003
A170: mrpp_4x4#4_24.cnf.out | B170: 9 | C170: 8 | D170: 258 | E170: 31 | F170: =E170/D170 -> 0.12015503875968993 | G170: 0 | H170: 0 | I170: 102 | J170: =I170/D170 -> 0.39534883720930231 | K170: 0 | L170: 0
A171: mrpp_4x4#4_5.cnf.out | B171: 0 | C171: 0 | D171: 260 | E171: 36 | F171: =E171/D171 -> 0.13846153846153847 | G171: 1 | H171: =G171/D171 -> 3.8461538461538464e-003 | I171: 22 | J171: =I171/D171 -> 8.461538461538462e-002 | K171: 0 | L171: 0
A172: mrpp_4x4#6_16.cnf.out | B172: 4 | C172: 26 | D172: 234 | E172: 60 | F172: =E172/D172 -> 0.25641025641025639 | G172: 0 | H172: 0 | I172: 49 | J172: =I172/D172 -> 0.20940170940170941 | K172: 0 | L172: 0
A173: mrpp_4x4#6_20.cnf.out | B173: 14 | C173: 39 | D173: 234 | E173: 60 | F173: =E173/D173 -> 0.25641025641025639 | G173: 0 | H173: 0 | I173: 49 | J173: =I173/D173 -> 0.20940170940170941 | K173: 0 | L173: 0
A174: mrpp_4x4#8_8.cnf.out | B174: 2 | C174: 2 | D174: 367 | E174: 83 | F174: =E174/D174 -> 0.22615803814713897 | G174: 0 | H174: 0 | I174: 13 | J174: =I174/D174 -> 3.5422343324250684e-002 | K174: 0 | L174: 0
A175: mrpp_6x6#10_10.cnf.out | B175: 7 | C175: 7 | D175: 751 | E175: 138 | F175: =E175/D175 -> 0.18375499334221038 | G175: 0 | H175: 0 | I175: 100 | J175: =I175/D175 -> 0.13315579227696406 | K175: 0 | L175: 0
A176: mrpp_6x6#10_8.cnf.out | B176: 0 | C176: 0 | D176: 858 | E176: 162 | F176: =E176/D176 -> 0.1888111888111888 | G176: 0 | H176: 0 | I176: 74 | J176: =I176/D176 -> 8.6247086247086241e-002 | K176: 0 | L176: 0
A177: mrpp_6x6#12_16.cnf.out | B177: 886 | C177: 589 | D177: 707 | E177: 145 | F177: =E177/D177 -> 0.2050919377652051 | G177: 0 | H177: 0 | I177: 148 | J177: =I177/D177 -> 0.20933521923620935 | K177: 0 | L177: 0
A178: mrpp_6x6#16_12.cnf.out | B178: 913 | C178: 913 | D178: 974 | E178: 182 | F178: =E178/D178 -> 0.18685831622176591 | G178: 0 | H178: 0 | I178: 44 | J178: =I178/D178 -> 4.5174537987679675e-002 | K178: 0 | L178: 0
A179: mrpp_6x6#18_12.cnf.out | B179: 2097 | C179: 2848 | D179: 930 | E179: 225 | F179: =E179/D179 -> 0.24193548387096775 | G179: 0 | H179: 0 | I179: 34 | J179: =I179/D179 -> 3.6559139784946237e-002 | K179: 0 | L179: 0
A180: mrpp_8x8#16_12.cnf.out | B180: 239 | C180: 222 | D180: 1743 | E180: 151 | F180: =E180/D180 -> 8.6632243258749284e-002 | G180: 0 | H180: 0 | I180: 182 | J180: =I180/D180 -> 0.10441767068273092 | K180: 0 | L180: 0
A181: mrpp_8x8#18_13.cnf.out | B181: 1453 | C181: 1747 | D181: 1850 | E181: 376 | F181: =E181/D181 -> 0.20324324324324325 | G181: 0 | H181: 0 | I181: 163 | J181: =I181/D181 -> 8.810810810810811e-002 | K181: 0 | L181: 0
A182: mrpp_8x8#22_11.cnf.out | B182: 255 | C182: 186 | D182: 5191 | E182: 2234 | F182: =E182/D182 -> 0.43036023887497593 | G182: 0 | H182: 0 | I182: 98 | J182: =I182/D182 -> 1.8878828742053554e-002 | K182: 86 | L182: =K182/D182 -> 1.6567135426700057e-002
A183: palac-uts-l06-ipc5-h34.cnf.out | B183: 204 | C183: 226 | D183: 100133 | E183: 97071 | F183: =E183/D183 -> 0.96942067050822411 | G183: 20 | H183: =G183/D183 -> 1.9973435331009756e-004 | I183: 0 | J183: 0 | K183: 195 | L183: =K183/D183 -> 1.9474099447734513e-003
A184: post-c32s-gcdm16-22.cnf.out | B184: 466 | C184: 1025 | D184: 129652 | E184: 128916 | F184: =E184/D184 -> 0.99432326535649274 | G184: 0 | H184: 0 | I184: 0 | J184: 0 | K184: 14 | L184: =K184/D184 -> 1.0798136550149632e-004
A185: q_query_3_l38_lambda.cnf.out | B185: 514 | C185: 336 | D185: 6001 | E185: 1677 | F185: =E185/D185 -> 0.2794534244292618 | G185: 63 | H185: =G185/D185 -> 1.0498250291618064e-002 | I185: 1 | J185: =I185/D185 -> 1.6663889351774705e-004 | K185: 1 | L185: =K185/D185 -> 1.6663889351774705e-004
A186: q_query_3_l39_lambda.cnf.out | B186: 406 | C186: 396 | D186: 6313 | E186: 1867 | F186: =E186/D186 -> 0.29573895137018852 | G186: 67 | H186: =G186/D186 -> 1.0613020750831618e-002 | I186: 1 | J186: =I186/D186 -> 1.5840329478853161e-004 | K186: 1 | L186: =K186/D186 -> 1.5840329478853161e-004
A187: q_query_3_l40_lambda.cnf.out | B187: 479 | C187: 309 | D187: 7152 | E187: 2055 | F187: =E187/D187 -> 0.28733221476510068 | G187: 75 | H187: =G187/D187 -> 1.0486577181208054e-002 | I187: 1 | J187: =I187/D187 -> 1.3982102908277405e-004 | K187: 1 | L187: =K187/D187 -> 1.3982102908277405e-004
A188: q_query_3_l41_lambda.cnf.out | B188: 374 | C188: 428 | D188: 7451 | E188: 2182 | F188: =E188/D188 -> 0.29284659777211114 | G188: 79 | H188: =G188/D188 -> 1.0602603677358744e-002 | I188: 1 | J188: =I188/D188 -> 1.3421017313112335e-004 | K188: 26 | L188: =K188/D188 -> 3.489464501409207e-003
A189: q_query_3_l42_lambda.cnf.out | B189: 454 | C189: 344 | D189: 8348 | E189: 2770 | F189: =E189/D189 -> 0.33181600383325349 | G189: 122 | H189: =G189/D189 -> 1.4614278869190225e-002 | I189: 1 | J189: =I189/D189 -> 1.1978917105893628e-004 | K189: 0 | L189: 0
A190: q_query_3_l43_lambda.cnf.out | B190: 407 | C190: 465 | D190: 9164 | E190: 3199 | F190: =E190/D190 -> 0.34908336970755127 | G190: 150 | H190: =G190/D190 -> 1.6368398079441293e-002 | I190: 1 | J190: =I190/D190 -> 1.0912265386294194e-004 | K190: 2 | L190: =K190/D190 -> 2.1824530772588389e-004
A191: q_query_3_L60_coli.sat.cnf.out | B191: 189 | C191: 147 | D191: 153927 | E191: 122274 | F191: =E191/D191 -> 0.79436356194819624 | G191: 5726 | H191: =G191/D191 -> 3.7199451688137881e-002 | I191: 1 | J191: =I191/D191 -> 6.4965860440338605e-006 | K191: 52 | L191: =K191/D191 -> 3.3782247428976072e-004
A192: q_query_3_L70_coli.sat.cnf.out | B192: 118 | C192: 133 | D192: 201731 | E192: 164962 | F192: =E192/D192 -> 0.81773252499615823 | G192: 8287 | H192: =G192/D192 -> 4.1079457297093655e-002 | I192: 1 | J192: =I192/D192 -> 4.9570963312530052e-006 | K192: 187 | L192: =K192/D192 -> 9.2697701394431201e-004
A193: Q3inK10.cnf.out | B193: 0 | C193: 0 | D193: 0 | E193: 0 | F193: 0 | G193: 0 | H193: 0 | I193: 0 | J193: 0 | K193: 0 | L193: 0
A194: rbsat-v760c43649g5.cnf.out | B194: 1902 | C194: 1590 | D194: 682 | E194: 172 | F194: =E194/D194 -> 0.25219941348973607 | G194: 10 | H194: =G194/D194 -> 1.466275659824047e-002 | I194: 1 | J194: =I194/D194 -> 1.4662756598240469e-003 | K194: 68 | L194: =K194/D194 -> 9.9706744868035185e-002
A195: rnd_100_27_s.cnf.out | B195: 236 | C195: 462 | D195: 1940 | E195: 588 | F195: =E195/D195 -> 0.30309278350515462 | G195: 136 | H195: =G195/D195 -> 7.0103092783505155e-002 | I195: 231 | J195: =I195/D195 -> 0.1190721649484536 | K195: 0 | L195: 0
A196: rnd_100_28_s.cnf.out | B196: 494 | C196: 1162 | D196: 849 | E196: 22 | F196: =E196/D196 -> 2.591283863368669e-002 | G196: 23 | H196: =G196/D196 -> 2.7090694935217905e-002 | I196: 562 | J196: =I196/D196 -> 0.66195524146054185 | K196: 0 | L196: 0
A197: SAT_dat.k60.debugged.cnf.out | B197: 3651 | C197: 2942 | D197: 28795 | E197: 16015 | F197: =E197/D197 -> 0.55617294669213402 | G197: 42 | H197: =G197/D197 -> 1.4585865601666956e-003 | I197: 220 | J197: =I197/D197 -> 7.6402153151588822e-003 | K197: 82 | L197: =K197/D197 -> 2.8477166174683106e-003
A198: SAT_dat.k65.cnf.out | B198: 2811 | D198: 24634 | E198: 12713 | F198: =E198/D198 -> 0.51607534302183977 | G198: 36 | H198: =G198/D198 -> 1.4613948201672485e-003 | I198: 59 | J198: =I198/D198 -> 2.3950637330518794e-003 | K198: 89 | L198: =K198/D198 -> 3.61289274985792e-003
A199: SAT_dat.k70-24_1_rule_1.cnf.out | B199: 5218 | D199: 43676 | E199: 39875 | F199: =E199/D199 -> 0.9129727997069329 | G199: 38 | H199: =G199/D199 -> 8.7004304423482005e-004 | I199: 92 | J199: =I199/D199 -> 2.1064200018316697e-003 | K199: 156 | L199: =K199/D199 -> 3.5717556552797877e-003
A200: SAT_dat.k80_04.cnf.out | B200: 157 | C200: 116 | D200: 56930 | E200: 47520 | F200: =E200/D200 -> 0.83470929211312139 | G200: 49 | H200: =G200/D200 -> 8.607061303354997e-004 | I200: 130 | J200: =I200/D200 -> 2.2835060600737748e-003 | K200: 287 | L200: =K200/D200 -> 5.0412787633936414e-003
A201: SAT_dat.k85.cnf.out | B201: 157 | D201: 58721 | E201: 46593 | F201: =E201/D201 -> 0.79346400776553527 | G201: 60 | H201: =G201/D201 -> 1.0217809642206366e-003 | I201: 145 | J201: =I201/D201 -> 2.4693039968665385e-003 | K201: 265 | L201: =K201/D201 -> 4.5128659253078117e-003
A202: schup-l2s-motst-2-k315.cnf.out | B202: 217 | C202: 341 | D202: 483267 | E202: 475294 | F202: =E202/D202 -> 0.98350187370542574 | G202: 681 | H202: =G202/D202 -> 1.4091589121541508e-003 | I202: 8 | J202: =I202/D202 -> 1.6553996031179452e-005 | K202: 48 | L202: =K202/D202 -> 9.9323976187076714e-005
A203: schuppan03_l2s_motors-stuck-2-k315-sat.used-as.sat04-435.cnf.out | B203: 247 | C203: 262 | D203: 483267 | E203: 475294 | F203: =E203/D203 -> 0.98350187370542574 | G203: 681 | H203: =G203/D203 -> 1.4091589121541508e-003 | I203: 8 | J203: =I203/D203 -> 1.6553996031179452e-005 | K203: 48 | L203: =K203/D203 -> 9.9323976187076714e-005
A204: sgen3-n120-s12930489-sat.cnf.out | B204: 20 | C204: 29 | D204: 78 | E204: 9 | F204: =E204/D204 -> 0.11538461538461539 | G204: 0 | H204: 0 | I204: 0 | J204: 0 | K204: 0 | L204: 0
A205: sgen3-n140-s18527668-sat.cnf.out | B205: 319 | C205: 360 | D205: 140 | E205: 100 | F205: =E205/D205 -> 0.7142857142857143 | G205: 1 | H205: =G205/D205 -> 7.1428571428571426e-003 | I205: 1 | J205: =I205/D205 -> 7.1428571428571426e-003 | K205: 5 | L205: =K205/D205 -> 3.5714285714285712e-002
A206: sgen3-n160-s40283905-sat.cnf.out | B206: 2783 | C206: 2593 | D206: 160 | E206: 113 | F206: =E206/D206 -> 0.70625 | G206: 0 | H206: 0 | I206: 0 | J206: 0 | K206: 12 | L206: =K206/D206 -> 0.075
A207: simon03_sat02_w08_14.used-as.sat04-359.cnf.out | B207: 261 | C207: 114 | D207: 95710 | E207: 91527 | F207: =E207/D207 -> 0.95629505798767112 | G207: 264 | H207: =G207/D207 -> 2.7583324626475813e-003 | I207: 60 | J207: =I207/D207 -> 6.2689374151081391e-004 | K207: 1 | L207: =K207/D207 -> 1.0448229025180232e-005
A208: simon03_sat02_w08_15.used-as.sat04-360.cnf.out | B208: 962 | C208: 302 | D208: 84343 | E208: 76551 | F208: =E208/D208 -> 0.90761533262985661 | G208: 421 | H208: =G208/D208 -> 4.9915227108355172e-003 | I208: 62 | J208: =I208/D208 -> 7.3509360587126378e-004 | K208: 32 | L208: =K208/D208 -> 3.7940315141742645e-004
A209: simon03_sat02bis_cnf-r4-b1-k1.1-comp.used-as.sat04-354.cnf.out | B209: 583 | C209: 1317 | D209: 2424 | E209: 2272 | F209: =E209/D209 -> 0.93729372937293731 | G209: 0 | H209: 0 | I209: 1 | J209: =I209/D209 -> 4.1254125412541255e-004 | K209: 64 | L209: =K209/D209 -> 2.6402640264026403e-002
A210: simon03_sat02bis_cnf-r4-b1-k1.2-comp.used-as.sat04-355.cnf.out | B210: 581 | C210: 2323 | D210: 2424 | E210: 2250 | F210: =E210/D210 -> 0.92821782178217827 | G210: 1 | H210: =G210/D210 -> 4.1254125412541255e-004 | I210: 1 | J210: =I210/D210 -> 4.1254125412541255e-004 | K210: 65 | L210: =K210/D210 -> 2.6815181518151814e-002
A211: simon03_sat02bis_cnt10.used-as.sat04-356.cnf.out | B211: 48 | C211: 57 | D211: 20470 | E211: 18210 | F211: =E211/D211 -> 0.88959452857840737 | G211: 29 | H211: =G211/D211 -> 1.4167073766487542e-003 | I211: 1 | J211: =I211/D211 -> 4.8851978505129459e-005 | K211: 0 | L211: 0
A212: simon03_sat02bis_dp11u10.used-as.sat04-357.cnf.out | B212: 1841 | D212: 21674 | E212: 19876 | F212: =E212/D212 -> 0.91704346221278954 | G212: 45 | H212: =G212/D212 -> 2.0762203561871368e-003 | I212: 1 | J212: =I212/D212 -> 4.6138230137491926e-005 | K212: 0 | L212: 0
A213: simon-s02b-r4b1k1.1.cnf.out | B213: 1063 | C213: 1361 | D213: 2424 | E213: 2272 | F213: =E213/D213 -> 0.93729372937293731 | G213: 0 | H213: 0 | I213: 1 | J213: =I213/D213 -> 4.1254125412541255e-004 | K213: 64 | L213: =K213/D213 -> 2.6402640264026403e-002
A214: simon-s02b-r4b1k1.2.cnf.out | B214: 1063 | C214: 2357 | D214: 2424 | E214: 2250 | F214: =E214/D214 -> 0.92821782178217827 | G214: 1 | H214: =G214/D214 -> 4.1254125412541255e-004 | I214: 1 | J214: =I214/D214 -> 4.1254125412541255e-004 | K214: 65 | L214: =K214/D214 -> 2.6815181518151814e-002
A215: simon-s03-fifo8-400.cnf.out | B215: 108 | D215: 3962 | E215: 1967 | F215: =E215/D215 -> 0.49646643109540634 | G215: 1 | H215: =G215/D215 -> 2.5239777889954568e-004 | I215: 1 | J215: =I215/D215 -> 2.5239777889954568e-004 | K215: 70 | L215: =K215/D215 -> 1.7667844522968199e-002
A216: simon-s03-w08-15.cnf.out | B216: 495 | C216: 363 | D216: 84343 | E216: 76551 | F216: =E216/D216 -> 0.90761533262985661 | G216: 421 | H216: =G216/D216 -> 4.9915227108355172e-003 | I216: 62 | J216: =I216/D216 -> 7.3509360587126378e-004 | K216: 32 | L216: =K216/D216 -> 3.7940315141742645e-004
A217: smtlib-qfbv-aigs-bin_eventlogadm_vc331235-tseitin.cnf.out | B217: 370 | C217: 1047 | D217: 69221 | E217: 49091 | F217: =E217/D217 -> 0.70919229713526244 | G217: 0 | H217: 0 | I217: 2285 | J217: =I217/D217 -> 3.3010213663483626e-002 | K217: 3 | L217: =K217/D217 -> 4.333944901113824e-005
A218: smtlib-qfbv-aigs-bin_eventlogadm_vc344392-tseitin.cnf.out | B218: 111 | C218: 77 | D218: 27937 | E218: 18816 | F218: =E218/D218 -> 0.67351540967176149 | G218: 0 | H218: 0 | I218: 4489 | J218: =I218/D218 -> 0.16068296524322584 | K218: 42 | L218: =K218/D218 -> 1.5033826108744675e-003
A219: smtlib-qfbv-aigs-bin_eventlogadm_vc352372-tseitin.cnf.out | B219: 183 | C219: 139 | D219: 27213 | E219: 18739 | F219: =E219/D219 -> 0.688604710983721 | G219: 0 | H219: 0 | I219: 4908 | J219: =I219/D219 -> 0.1803549774005071 | K219: 3 | L219: =K219/D219 -> 1.1024142872891633e-004
A220: smtlib-qfbv-aigs-bin_libmsrpc_vc1225297-tseitin.cnf.out | B220: 41 | C220: 37 | D220: 25902 | E220: 19137 | F220: =E220/D220 -> 0.73882325689135975 | G220: 4 | H220: =G220/D220 -> 1.54428229480349e-004 | I220: 1230 | J220: =I220/D220 -> 4.7486680565207322e-002 | K220: 2 | L220: =K220/D220 -> 7.7214114740174498e-005
A221: smtlib-qfbv-aigs-bin_libmsrpc_vc1225336-tseitin.cnf.out | B221: 74 | C221: 56 | D221: 32123 | E221: 25786 | F221: =E221/D221 -> 0.80272701802446844 | G221: 1 | H221: =G221/D221 -> 3.1130342745073624e-005 | I221: 1883 | J221: =I221/D221 -> 5.8618435388973635e-002 | K221: 1 | L221: =K221/D221 -> 3.1130342745073624e-005
A222: smtlib-qfbv-aigs-bin_libmsrpc_vc1228572-tseitin.cnf.out | B222: 105 | C222: 87 | D222: 38073 | E222: 27356 | F222: =E222/D222 -> 0.71851443280014704 | G222: 0 | H222: 0 | I222: 1622 | J222: =I222/D222 -> 4.2602369132981377e-002 | K222: 2 | L222: =K222/D222 -> 5.2530664775562736e-005
A223: smtlib-qfbv-aigs-bin_libsmbclient_vc1225238-tseitin.cnf.out | B223: 42 | C223: 39 | D223: 23411 | E223: 17139 | F223: =E223/D223 -> 0.73209175174063479 | G223: 0 | H223: 0 | I223: 2033 | J223: =I223/D223 -> 8.6839519883815303e-002 | K223: 5 | L223: =K223/D223 -> 2.135748152577848e-004
A224: smtlib-qfbv-aigs-bin_libsmbclient_vc1225819-tseitin.cnf.out | B224: 106 | C224: 139 | D224: 40006 | E224: 29039 | F224: =E224/D224 -> 0.7258661200819877 | G224: 0 | H224: 0 | I224: 2254 | J224: =I224/D224 -> 5.6341548767684844e-002 | K224: 2 | L224: =K224/D224 -> 4.9992501124831273e-005
A225: smtlib-qfbv-aigs-bin_libsmbclient_vc1228447-tseitin.cnf.out | B225: 107 | C225: 85 | D225: 38591 | E225: 27630 | F225: =E225/D225 -> 0.7159700448291052 | G225: 0 | H225: 0 | I225: 1548 | J225: =I225/D225 -> 4.0112979710295149e-002 | K225: 20 | L225: =K225/D225 -> 5.1825555181259878e-004
A226: smtlib-qfbv-aigs-bin_libsmbclient_vc1228502-tseitin.cnf.out | B226: 132 | C226: 110 | D226: 40073 | E226: 29073 | F226: =E226/D226 -> 0.72550096074663739 | G226: 0 | H226: 0 | I226: 2553 | J226: =I226/D226 -> 6.3708731564894067e-002 | K226: 1 | L226: =K226/D226 -> 2.4954458113942057e-005
A227: smtlib-qfbv-aigs-bin_libsmbsharemodes_vc4322-tseitin.cnf.out | B227: 268 | C227: 185 | D227: 31666 | E227: 20879 | F227: =E227/D227 -> 0.65935072317311938 | G227: 0 | H227: 0 | I227: 4249 | J227: =I227/D227 -> 0.13418177224783678 | K227: 4 | L227: =K227/D227 -> 1.2631844880944861e-004
A228: smtlib-qfbv-aigs-bin_libsmbsharemodes_vc5759-tseitin.cnf.out | B228: 42 | C228: 28 | D228: 18484 | E228: 12146 | F228: =E228/D228 -> 0.65710885089807403 | G228: 0 | H228: 0 | I228: 2957 | J228: =I228/D228 -> 0.15997619562865181 | K228: 3 | L228: =K228/D228 -> 1.6230253191949794e-004
A229: smtlib-qfbv-aigs-bin_libsmbsharemodes_vc6201-tseitin.cnf.out | B229: 69 | C229: 61 | D229: 27403 | E229: 20203 | F229: =E229/D229 -> 0.73725504506805828 | G229: 0 | H229: 0 | I229: 1440 | J229: =I229/D229 -> 5.254899098638835e-002 | K229: 2 | L229: =K229/D229 -> 7.2984709703317156e-005
A230: smtlib-qfbv-aigs-bin_libsmbsharemodes_vc7701-tseitin.cnf.out | B230: 128 | C230: 127 | D230: 43138 | E230: 25376 | F230: =E230/D230 -> 0.58825165747137098 | G230: 1 | H230: =G230/D230 -> 2.318141777551115e-005 | I230: 2550 | J230: =I230/D230 -> 5.9112615327553436e-002 | K230: 1 | L230: =K230/D230 -> 2.318141777551115e-005
A231: smtlib-qfbv-aigs-rfunit_flat-64-tseitin.cnf.out | B231: 389 | C231: 133 | D231: 148 | E231: 77 | F231: =E231/D231 -> 0.52027027027027029 | G231: 0 | H231: 0 | I231: 157 | J231: =I231/D231 -> 1.0608108108108107 | K231: 0 | L231: 0
A232: srhd-sgi-m27-q225-n25-p15-s58217873.cnf.out | B232: 96 | C232: 119 | D232: 550 | E232: 452 | F232: =E232/D232 -> 0.82181818181818178 | G232: 59 | H232: =G232/D232 -> 0.10727272727272727 | I232: 0 | J232: 0 | K232: 21 | L232: =K232/D232 -> 3.8181818181818185e-002
A233: srhd-sgi-m27-q225-n25-p30-s70617701.cnf.out | B233: 1759 | C233: 1023 | D233: 658 | E233: 468 | F233: =E233/D233 -> 0.71124620060790278 | G233: 53 | H233: =G233/D233 -> 8.0547112462006076e-002 | I233: 1 | J233: =I233/D233 -> 1.5197568389057751e-003 | K233: 24 | L233: =K233/D233 -> 3.64741641337386e-002
A234: srhd-sgi-m32-q326.25-n30-p15-s44266159.cnf.out | B234: 6879 | C234: 9700 | D234: 792 | E234: 625 | F234: =E234/D234 -> 0.78914141414141414 | G234: 88 | H234: =G234/D234 -> 0.1111111111111111 | I234: 0 | J234: 0 | K234: 27 | L234: =K234/D234 -> 3.4090909090909088e-002
A235: srhd-sgi-m37-q446.25-n35-p15-s25120921.cnf.out | B235: 15978 | C235: 8462 | D235: 1106 | E235: 949 | F235: =E235/D235 -> 0.85804701627486435 | G235: 80 | H235: =G235/D235 -> 7.2332730560578665e-002 | I235: 0 | J235: 0 | K235: 29 | L235: =K235/D235 -> 2.6220614828209764e-002
A236: stable-300-0.1-20-98765432130020.cnf.out | B236: 7465 | C236: 17777 | D236: 252 | E236: 2 | F236: =E236/D236 -> 7.9365079365079361e-003 | G236: 0 | H236: 0 | I236: 1 | J236: =I236/D236 -> 3.968253968253968e-003 | K236: 10 | L236: =K236/D236 -> 3.968253968253968e-002
A237: tip_bmc_sat_nusmv.tcas-t^5.B.cnf.out | B237: 9 | C237: 8 | D237: 35097 | E237: 29678 | F237: =E237/D237 -> 0.84559933897484119 | G237: 54 | H237: =G237/D237 -> 1.5385930421403539e-003 | I237: 28 | J237: =I237/D237 -> 7.9778898481351677e-004 | K237: 1 | L237: =K237/D237 -> 2.8492463743339886e-005
A238: traffic_r_sat.cnf.out | B238: 262 | C238: 212 | D238: 0 | E238: 0 | F238: 0 | G238: 0 | H238: 0 | I238: 0 | J238: 0 | K238: 0 | L238: 0
A239: UCG-10-10p1.cnf.out | B239: 107 | C239: 179 | D239: 120964 | E239: 112785 | F239: =E239/D239 -> 0.93238484177110548 | G239: 3 | H239: =G239/D239 -> 2.4800767170397806e-005 | I239: 1 | J239: =I239/D239 -> 8.2669223901326018e-006 | K239: 61 | L239: =K239/D239 -> 5.0428226579808872e-004
A240: UCG-15-10p1.cnf.out | B240: 972 | C240: 1081 | D240: 183337 | E240: 170400 | F240: =E240/D240 -> 0.9294359567354108 | G240: 140 | H240: =G240/D240 -> 7.6362109121453931e-004 | I240: 0 | J240: 0 | K240: 60 | L240: =K240/D240 -> 3.2726618194908828e-004
A241: UCG-15-5p1.cnf.out | B241: 132 | C241: 146 | D241: 147302 | E241: 137813 | F241: =E241/D241 -> 0.93558132272474237 | G241: 73 | H241: =G241/D241 -> 4.9558050807185241e-004 | I241: 1 | J241: =I241/D241 -> 6.7887740831760603e-006 | K241: 26 | L241: =K241/D241 -> 1.7650812616257756e-004
A242: UCG-20-10p1.cnf.out | B242: 5483 | D242: 238029 | E242: 221856 | F242: =E242/D242 -> 0.9320544975612215 | G242: 3 | H242: =G242/D242 -> 1.2603506295451394e-005 | I242: 0 | J242: 0 | K242: 133 | L242: =K242/D242 -> 5.5875544576501179e-004
A243: UCG-20-5p1.cnf.out | B243: 1229 | C243: 1291 | D243: 203571 | E243: 190182 | F243: =E243/D243 -> 0.93422933521965312 | G243: 191 | H243: =G243/D243 -> 9.3824758929317049e-004 | I243: 0 | J243: 0 | K243: 81 | L243: =K243/D243 -> 3.9789557451699897e-004
A244: UR-10-10p1.cnf.out | B244: 368 | C244: 365 | D244: 120845 | E244: 112802 | F244: =E244/D244 -> 0.9334436675079647 | G244: 42 | H244: =G244/D244 -> 3.4755265008895695e-004 | I244: 0 | J244: 0 | K244: 54 | L244: =K244/D244 -> 4.4685340725723031e-004
A245: UR-15-10p1.cnf.out | B245: 3370 | C245: 3453 | D245: 182982 | E245: 169895 | F245: =E245/D245 -> 0.92847930397525436 | G245: 93 | H245: =G245/D245 -> 5.0824671279142209e-004 | I245: 0 | J245: 0 | K245: 108 | L245: =K245/D245 -> 5.9022198904810311e-004
A246: UR-15-5p1.cnf.out | B246: 388 | C246: 320 | D246: 146870 | E246: 136920 | F246: =E246/D246 -> 0.93225301286852313 | G246: 176 | H246: =G246/D246 -> 1.1983386668482331e-003 | I246: 0 | J246: 0 | K246: 73 | L246: =K246/D246 -> 4.9703819704500574e-004
A247: UR-20-5p1.cnf.out | B247: 4594 | C247: 8450 | D247: 202860 | E247: 188657 | F247: =E247/D247 -> 0.92998619737750177 | G247: 183 | H247: =G247/D247 -> 9.020999704229518e-004 | I247: 0 | J247: 0 | K247: 286 | L247: =K247/D247 -> 1.4098392980380558e-003
A248: UTI-10-10p1.cnf.out | B248: 602 | C248: 495 | D248: 120225 | E248: 111991 | F248: =E248/D248 -> 0.93151174880432519 | G248: 75 | H248: =G248/D248 -> 6.2383031815346226e-004 | I248: 0 | J248: 0 | K248: 465 | L248: =K248/D248 -> 3.8677479725514659e-003
A249: UTI-10-5t1.cnf.out | B249: 8 | C249: 4 | D249: 104454 | E249: 100772 | F249: =E249/D249 -> 0.96475003350757271 | G249: 108 | H249: =G249/D249 -> 1.033947957952783e-003 | I249: 0 | J249: 0 | K249: 16 | L249: =K249/D249 -> 1.5317747525226417e-004
A250: UTI-15-10p1.cnf.out | B250: 938 | C250: 1386 | D250: 182077 | E250: 169764 | F250: =E250/D250 -> 0.93237476452270196 | G250: 17 | H250: =G250/D250 -> 9.336709194461684e-005 | I250: 1 | J250: =I250/D250 -> 5.492181879095108e-006 | K250: 537 | L250: =K250/D250 -> 2.9493016690740731e-003
A251: UTI-15-5p1.cnf.out | B251: 3656 | C251: 3891 | D251: 145892 | E251: 135621 | F251: =E251/D251 -> 0.92959860718887943 | G251: 88 | H251: =G251/D251 -> 6.0318591835056064e-004 | I251: 0 | J251: 0 | K251: 460 | L251: =K251/D251 -> 3.1530173004688401e-003
A252: UTI-20-10t1.cnf.out | B252: 13 | C252: 16 | D252: 230122 | E252: 222215 | F252: =E252/D252 -> 0.96563996488818971 | G252: 208 | H252: =G252/D252 -> 9.038683828577885e-004 | I252: 1 | J252: =I252/D252 -> 4.3455210714316751e-006 | K252: 40 | L252: =K252/D252 -> 1.7382084285726701e-004
A253: UTI-20-5p1.cnf.out | B253: 17174 | D253: 209876 | E253: 198763 | F253: =E253/D253 -> 0.94704968648154153 | G253: 197 | H253: =G253/D253 -> 9.3864948826926373e-004 | I253: 1 | J253: =I253/D253 -> 4.7647182145647902e-006 | K253: 27 | L253: =K253/D253 -> 1.2864739179324934e-004
A254: uts-l06-ipc5-h34-unknown.cnf.out | B254: 143 | C254: 175 | D254: 100133 | E254: 97071 | F254: =E254/D254 -> 0.96942067050822411 | G254: 20 | H254: =G254/D254 -> 1.9973435331009756e-004 | I254: 0 | J254: 0 | K254: 195 | L254: =K254/D254 -> 1.9474099447734513e-003
A255: uts-l06-ipc5-h35-unknown.cnf.out | B255: 560 | C255: 876 | D255: 16731 | E255: 13733 | F255: =E255/D255 -> 0.82081166696551311 | G255: 0 | H255: 0 | I255: 0 | J255: 0 | K255: 1004 | L255: =K255/D255 -> 6.0008367700675393e-002
A256: VanDerWaerden_pd_2-3-21_399.cnf.out | B256: 1927 | C256: 1726 | D256: 196 | E256: 101 | F256: =E256/D256 -> 0.51530612244897955 | G256: 0 | H256: 0 | I256: 1 | J256: =I256/D256 -> 5.1020408163265302e-003 | K256: 51 | L256: =K256/D256 -> 0.26020408163265307
A257: vda_gr_rcs_w9.shuffled.cnf.out | B257: 0 | C257: 0 | D257: 0 | E257: 0 | F257: 0 | G257: 0 | H257: 0 | I257: 0 | J257: 0 | K257: 0 | L257: 0
A258: velev-pipe-sat-1.0-b10.cnf.out | B258: 3111 | D258: 50015 | E258: 42062 | F258: =E258/D258 -> 0.84098770368889331 | G258: 0 | H258: 0 | I258: 1335 | J258: =I258/D258 -> 2.6691992402279315e-002 | K258: 148 | L258: =K258/D258 -> 2.9591122663201038e-003
A259: velev-pipe-sat-1.0-b9.cnf.out | B259: 12907 | D259: 38459 | E259: 26228 | F259: =E259/D259 -> 0.6819730102186744 | G259: 0 | H259: 0 | I259: 1069 | J259: =I259/D259 -> 2.7795834525078656e-002 | K259: 158 | L259: =K259/D259 -> 4.1082711458956291e-003
A260: vmpc_26.cnf.out | B260: 51 | C260: 70 | D260: 676 | E260: 598 | F260: =E260/D260 -> 0.88461538461538458 | G260: 0 | H260: 0 | I260: 1 | J260: =I260/D260 -> 1.4792899408284023e-003 | K260: 15 | L260: =K260/D260 -> 2.2189349112426034e-002
A261: vmpc_27.cnf.out | B261: 89 | C261: 175 | D261: 677 | E261: 36 | F261: =E261/D261 -> 5.3175775480059084e-002 | G261: 0 | H261: 0 | I261: 1 | J261: =I261/D261 -> 1.4771048744460858e-003 | K261: 0 | L261: 0
A262: vmpc_28.cnf.out | B262: 294 | C262: 413 | D262: 730 | E262: 112 | F262: =E262/D262 -> 0.15342465753424658 | G262: 0 | H262: 0 | I262: 1 | J262: =I262/D262 -> 1.3698630136986301e-003 | K262: 7 | L262: =K262/D262 -> 9.5890410958904115e-003
A263: vmpc_29.cnf.out | B263: 1421 | C263: 1652 | D263: 841 | E263: 732 | F263: =E263/D263 -> 0.87039239001189062 | G263: 0 | H263: 0 | I263: 1 | J263: =I263/D263 -> 1.1890606420927466e-003 | K263: 34 | L263: =K263/D263 -> 4.042806183115339e-002
A264: vmpc_30.cnf.out | B264: 889 | C264: 937 | D264: 848 | E264: 134 | F264: =E264/D264 -> 0.15801886792452829 | G264: 0 | H264: 0 | I264: 1 | J264: =I264/D264 -> 1.1792452830188679e-003 | K264: 0 | L264: 0
A265: vmpc_31.cnf.out | B265: 1518 | C265: 1923 | D265: 961 | E265: 793 | F265: =E265/D265 -> 0.82518210197710717 | G265: 0 | H265: 0 | I265: 1 | J265: =I265/D265 -> 1.0405827263267431e-003 | K265: 32 | L265: =K265/D265 -> 3.3298647242455778e-002
A266: vmpc_33.cnf.out | B266: 10062 | C266: 7698 | D266: 994 | E266: 33 | F266: =E266/D266 -> 3.3199195171026159e-002 | G266: 0 | H266: 0 | I266: 1 | J266: =I266/D266 -> 1.006036217303823e-003 | K266: 8 | L266: =K266/D266 -> 8.0482897384305842e-003